{"schema":"athena.character.capability_manifest","schema_version":"2.0","id":"athena.cold_tsundere.expressive","version":"2.0.0","namespace":"athena.core","character_id":"athena.test.cold_tsundere","performance_profile":"athena.cold_tsundere.expressive.v2","minimum_runtime_version":"2.0.0","face_regions":["brow","eyelid","eye_shape","pupil","cheek","nose","lip","jaw"],"track_order":["face","gaze","head_neck","shoulders","torso","left_arm","right_arm","left_hand","right_hand","left_leg","right_leg","action","speech"],"capabilities":[{"id":"athena.core:emotion/neutral","kind":"emotion","version":"2.0.0","available":true,"channels":["face","gaze","body.upper","voice"],"resource_claims":["face.primary","gaze.primary","body.upper.primary","voice.primary"],"parameters":{"type":"object","properties":{},"additionalProperties":false},"safety_class":"cosmetic","interruptibility":"blend_out","minimum_runtime_version":"2.0.0","timing":{"minimum_duration_ms":40,"maximum_duration_ms":30000,"blendable":true},"allowed_sides":["left","right","both","center"]},{"id":"athena.core:emotion/annoyed","kind":"emotion","version":"2.0.0","available":true,"channels":["face","gaze","body.upper","voice"],"resource_claims":["face.primary","gaze.primary","body.upper.primary","voice.primary"],"parameters":{"type":"object","properties":{},"additionalProperties":false},"safety_class":"cosmetic","interruptibility":"blend_out","minimum_runtime_version":"2.0.0","timing":{"minimum_duration_ms":40,"maximum_duration_ms":30000,"blendable":true},"allowed_sides":["left","right","both","center"]},{"id":"athena.core:emotion/concerned","kind":"emotion","version":"2.0.0","available":true,"channels":["face","gaze","body.upper","voice"],"resource_claims":["face.primary","gaze.primary","body.upper.primary","voice.primary"],"parameters":{"type":"object","properties":{},"additionalProperties":false},"safety_class":"cosmetic","interruptibility":"blend_out","minimum_runtime_version":"2.0.0","timing":{"minimum_duration_ms":40,"maximum_duration_ms":30000,"blendable":true},"allowed_sides":["left","right","both","center"]},{"id":"athena.core:emotion/amused","kind":"emotion","version":"2.0.0","available":true,"channels":["face","gaze","body.upper","voice"],"resource_claims":["face.primary","gaze.primary","body.upper.primary","voice.primary"],"parameters":{"type":"object","properties":{},"additionalProperties":false},"safety_class":"cosmetic","interruptibility":"blend_out","minimum_runtime_version":"2.0.0","timing":{"minimum_duration_ms":40,"maximum_duration_ms":30000,"blendable":true},"allowed_sides":["left","right","both","center"]},{"id":"athena.core:emotion/happy","kind":"emotion","version":"2.0.0","available":true,"channels":["face","gaze","body.upper","voice"],"resource_claims":["face.primary","gaze.primary","body.upper.primary","voice.primary"],"parameters":{"type":"object","properties":{},"additionalProperties":false},"safety_class":"cosmetic","interruptibility":"blend_out","minimum_runtime_version":"2.0.0","timing":{"minimum_duration_ms":40,"maximum_duration_ms":30000,"blendable":true},"allowed_sides":["left","right","both","center"]},{"id":"athena.core:emotion/surprised","kind":"emotion","version":"2.0.0","available":true,"channels":["face","gaze","body.upper","voice"],"resource_claims":["face.primary","gaze.primary","body.upper.primary","voice.primary"],"parameters":{"type":"object","properties":{},"additionalProperties":false},"safety_class":"cosmetic","interruptibility":"blend_out","minimum_runtime_version":"2.0.0","timing":{"minimum_duration_ms":40,"maximum_duration_ms":30000,"blendable":true},"allowed_sides":["left","right","both","center"]},{"id":"athena.core:emotion/embarrassed","kind":"emotion","version":"2.0.0","available":true,"channels":["face","gaze","body.upper","voice"],"resource_claims":["face.primary","gaze.primary","body.upper.primary","voice.primary"],"parameters":{"type":"object","properties":{},"additionalProperties":false},"safety_class":"cosmetic","interruptibility":"blend_out","minimum_runtime_version":"2.0.0","timing":{"minimum_duration_ms":40,"maximum_duration_ms":30000,"blendable":true},"allowed_sides":["left","right","both","center"]},{"id":"athena.core:emotion/sad","kind":"emotion","version":"2.0.0","available":true,"channels":["face","gaze","body.upper","voice"],"resource_claims":["face.primary","gaze.primary","body.upper.primary","voice.primary"],"parameters":{"type":"object","properties":{},"additionalProperties":false},"safety_class":"cosmetic","interruptibility":"blend_out","minimum_runtime_version":"2.0.0","timing":{"minimum_duration_ms":40,"maximum_duration_ms":30000,"blendable":true},"allowed_sides":["left","right","both","center"]},{"id":"athena.core:emotion/afraid","kind":"emotion","version":"2.0.0","available":true,"channels":["face","gaze","body.upper","voice"],"resource_claims":["face.primary","gaze.primary","body.upper.primary","voice.primary"],"parameters":{"type":"object","properties":{},"additionalProperties":false},"safety_class":"cosmetic","interruptibility":"blend_out","minimum_runtime_version":"2.0.0","timing":{"minimum_duration_ms":40,"maximum_duration_ms":30000,"blendable":true},"allowed_sides":["left","right","both","center"]},{"id":"athena.core:emotion/determined","kind":"emotion","version":"2.0.0","available":true,"channels":["face","gaze","body.upper","voice"],"resource_claims":["face.primary","gaze.primary","body.upper.primary","voice.primary"],"parameters":{"type":"object","properties":{},"additionalProperties":false},"safety_class":"cosmetic","interruptibility":"blend_out","minimum_runtime_version":"2.0.0","timing":{"minimum_duration_ms":40,"maximum_duration_ms":30000,"blendable":true},"allowed_sides":["left","right","both","center"]},{"id":"athena.core:emotion/tender","kind":"emotion","version":"2.0.0","available":true,"channels":["face","gaze","body.upper","voice"],"resource_claims":["face.primary","gaze.primary","body.upper.primary","voice.primary"],"parameters":{"type":"object","properties":{},"additionalProperties":false},"safety_class":"cosmetic","interruptibility":"blend_out","minimum_runtime_version":"2.0.0","timing":{"minimum_duration_ms":40,"maximum_duration_ms":30000,"blendable":true},"allowed_sides":["left","right","both","center"]},{"id":"athena.core:emotion/angry","kind":"emotion","version":"2.0.0","available":true,"channels":["face","gaze","body.upper","voice"],"resource_claims":["face.primary","gaze.primary","body.upper.primary","voice.primary"],"parameters":{"type":"object","properties":{},"additionalProperties":false},"safety_class":"cosmetic","interruptibility":"blend_out","minimum_runtime_version":"2.0.0","timing":{"minimum_duration_ms":40,"maximum_duration_ms":30000,"blendable":true},"allowed_sides":["left","right","both","center"]},{"id":"athena.core:face_brow/neutral","kind":"face_brow","version":"2.0.0","available":true,"channels":["face"],"resource_claims":["face.primary"],"parameters":{"type":"object","properties":{},"additionalProperties":false},"safety_class":"cosmetic","interruptibility":"blend_out","minimum_runtime_version":"2.0.0","timing":{"minimum_duration_ms":40,"maximum_duration_ms":30000,"blendable":true},"allowed_sides":["left","right","both","center"]},{"id":"athena.core:face_brow/lowered","kind":"face_brow","version":"2.0.0","available":true,"channels":["face"],"resource_claims":["face.primary"],"parameters":{"type":"object","properties":{},"additionalProperties":false},"safety_class":"cosmetic","interruptibility":"blend_out","minimum_runtime_version":"2.0.0","timing":{"minimum_duration_ms":40,"maximum_duration_ms":30000,"blendable":true},"allowed_sides":["left","right","both","center"]},{"id":"athena.core:face_brow/inner_raise","kind":"face_brow","version":"2.0.0","available":true,"channels":["face"],"resource_claims":["face.primary"],"parameters":{"type":"object","properties":{},"additionalProperties":false},"safety_class":"cosmetic","interruptibility":"blend_out","minimum_runtime_version":"2.0.0","timing":{"minimum_duration_ms":40,"maximum_duration_ms":30000,"blendable":true},"allowed_sides":["left","right","both","center"]},{"id":"athena.core:face_brow/outer_raise","kind":"face_brow","version":"2.0.0","available":true,"channels":["face"],"resource_claims":["face.primary"],"parameters":{"type":"object","properties":{},"additionalProperties":false},"safety_class":"cosmetic","interruptibility":"blend_out","minimum_runtime_version":"2.0.0","timing":{"minimum_duration_ms":40,"maximum_duration_ms":30000,"blendable":true},"allowed_sides":["left","right","both","center"]},{"id":"athena.core:face_brow/single_raise","kind":"face_brow","version":"2.0.0","available":true,"channels":["face"],"resource_claims":["face.primary"],"parameters":{"type":"object","properties":{},"additionalProperties":false},"safety_class":"cosmetic","interruptibility":"blend_out","minimum_runtime_version":"2.0.0","timing":{"minimum_duration_ms":40,"maximum_duration_ms":30000,"blendable":true},"allowed_sides":["left","right","both","center"]},{"id":"athena.core:face_eyelid/neutral","kind":"face_eyelid","version":"2.0.0","available":true,"channels":["face"],"resource_claims":["face.primary"],"parameters":{"type":"object","properties":{},"additionalProperties":false},"safety_class":"cosmetic","interruptibility":"blend_out","minimum_runtime_version":"2.0.0","timing":{"minimum_duration_ms":40,"maximum_duration_ms":30000,"blendable":true},"allowed_sides":["left","right","both","center"]},{"id":"athena.core:face_eyelid/narrowed","kind":"face_eyelid","version":"2.0.0","available":true,"channels":["face"],"resource_claims":["face.primary"],"parameters":{"type":"object","properties":{},"additionalProperties":false},"safety_class":"cosmetic","interruptibility":"blend_out","minimum_runtime_version":"2.0.0","timing":{"minimum_duration_ms":40,"maximum_duration_ms":30000,"blendable":true},"allowed_sides":["left","right","both","center"]},{"id":"athena.core:face_eyelid/wide","kind":"face_eyelid","version":"2.0.